user_name,date,text,clean_text,sentiment,sentiment_score
United States of Healthcare,2020-12-27 21:01:39,@Craig_A_Spencer @TheAtlantic Fantastic article. Thank you. The stat on the impact of universal mask wearing over t… https://t.co/BcOlapgKta,craig a spencer theatlantic fantastic article thank you the stat on the impact of universal mask wearing over t https t co bcolapgkta,5 stars,5
Argus News,2021-11-05 06:37:48,"More than 116.50 crore #COVIDVaccine doses provided to States/UTs; More than 15.54 crore balance &amp; unutilised doses still available with States/UTs. In the new phase, Centre will procure &amp; supply (free of cost) 75% of the vaccines being produced in country to States &amp; UTs: GoI https://t.co/hUTR227eSq",more than 116 50 crore covidvaccine doses provided to states uts more than 15 54 crore balance amp unutilised doses still available with states uts in the new phase centre will procure amp supply free of cost 75 of the vaccines being produced in country to states amp uts goi https t co hutr227esq,5 stars,5
alain.tremblay,2021-12-05 15:48:01,"So proud of NE #Calgary with incredible 99% #CovidVaccine rate. Not quite the Bronx, but represents area of the city with higher numbers of new Canadians, lower incomes etc... It is possible! 

#yyc @JyotiGondek @RajDhaliwal_YYC @chabot4calgary @CMOH_Alberta  @dryiu_verna https://t.co/gul4PLpQQk",so proud of ne calgary with incredible 99 covidvaccine rate not quite the bronx but represents area of the city with higher numbers of new canadians lower incomes etc it is possible yyc jyotigondek rajdhaliwal yyc chabot4calgary cmoh alberta dryiu verna https t co gul4plpqqk,5 stars,5
Whitney Mixon,2021-02-24 03:32:34,"I got the shot &amp; I didn’t get to take a pic afterwards...so here’s a rEeL. Lol 

#covid #covidvaccine… https://t.co/eeeHq7E14G",i got the shot amp i didn t get to take a pic afterwards so here s a reel lol covid covidvaccine https t co eeehq7e14g,3 stars,3
McSujesh,2021-05-26 18:47:46,"USA 🇺🇸 vaccinated 50% of their people until yesterday.
In India 🇮🇳, chaos in vaccination &amp; death tolls were hijacked by Lakshadweep &amp; socialmedia ban. 
#CovidVaccine #covid #IndiaFightsCorona #LakshadweepAdministrator #TwitterBanInIndia #Whatsappban #FacebookBan #InstagramBan",usa vaccinated 50 of their people until yesterday in india chaos in vaccination amp death tolls were hijacked by lakshadweep amp socialmedia ban covidvaccine covid indiafightscorona lakshadweepadministrator twitterbaninindia whatsappban facebookban instagramban,1 star,1
NHS Merton,2022-04-18 08:30:05,"We've got Merton walk-in #CovidVaccine clinics across the borough this week. Find a site and a time that is good for you. Come for your 1st, 2nd or booster dose - or just for a chat. Dates and times vary - find details and more venues here https://t.co/GcZw2coaZR https://t.co/5mMPoM0FiQ",we ve got merton walk in covidvaccine clinics across the borough this week find a site and a time that is good for you come for your 1st 2nd or booster dose or just for a chat dates and times vary find details and more venues here https t co gczw2coazr https t co 5mmpom0fiq,4 stars,4
Anekanth Bahubali,2021-03-24 14:37:23,"Mark my words, every death from this point will be purely our repeated mistake. Be responsible, wearing mask correc… https://t.co/tNrlYk1ujX",mark my words every death from this point will be purely our repeated mistake be responsible wearing mask correc https t co tnrlyk1ujx,1 star,1
Darren&Sandy H,2021-05-29 18:50:31,I got my vaccine today and i feel better then ever please go get it. Its 1 step closer to normal again #CovidVaccine,i got my vaccine today and i feel better then ever please go get it its 1 step closer to normal again covidvaccine,5 stars,5
DAZL HQ Dance Studio,2021-02-22 09:49:24,The @DAZL_Leeds team are all so thankful to @nhsleeds @LCHNHSTrust all been given their #COVIDVaccine the vaccine i… https://t.co/q8ZXXLTg22,the dazl leeds team are all so thankful to nhsleeds lchnhstrust all been given their covidvaccine the vaccine i https t co q8zxxltg22,1 star,1
I. R. Evangelista,2020-11-18 22:25:08,"@SabrinaMBetts Hello, please postpone the #TokyoOlympics, #ParisOlympics and #LAOlympics to #2024year, #2028year &amp;… https://t.co/0Dpel4FUT9",sabrinambetts hello please postpone the tokyoolympics parisolympics and laolympics to 2024year 2028year amp https t co 0dpel4fut9,1 star,1
BrianDude🌊🌊,2021-12-17 02:23:44,"NYC doubled #Covid_19 positivity rate every 4 days. Not good folks as  you can not go into a restaurant with out vaccination!

NYU and Cornel went back to online classes. We need a #Omicron specific boaster. 
#COVID19 #CovidVaccine",nyc doubled covid 19 positivity rate every 4 days not good folks as you can not go into a restaurant with out vaccination nyu and cornel went back to online classes we need a omicron specific boaster covid19 covidvaccine,1 star,1
Sputnik,2021-04-08 22:34:00,"Vaccine shortage ignites political blame game in India as COVID cases shoot up

#COVID19 #CovidVaccine  
https://t.co/QPcy3YMpwq",vaccine shortage ignites political blame game in india as covid cases shoot up covid19 covidvaccine https t co qpcy3ympwq,1 star,1
andrea albrigoni,2022-05-07 16:51:34,"Drinking This After COVID Vaccine Can Lead to Miserable Side Effects, Experts Say

#immunesystem #news #beer #healthyeating #healthy #alcoholicdrinks #covidvaccine
https://t.co/NABS2oZUP3",drinking this after covid vaccine can lead to miserable side effects experts say immunesystem news beer healthyeating healthy alcoholicdrinks covidvaccine https t co nabs2ozup3,1 star,1
Paget Hines,2021-01-30 22:28:46,Love me some solid stats! #CovidVaccine https://t.co/YaeupWRGLn,love me some solid stats covidvaccine https t co yaeupwrgln,5 stars,5
PatrioticRight,2022-02-14 19:17:27,"Fauci said that the Pfizer Covid vaccine for children under 5 years old will be here soon. The liberals’ science experiment is growing faster…

#PatrioticRight #Covid19 #CovidVaccine #ChildAbuse

https://t.co/D7viJpbHLq https://t.co/FpK02kj7KB",fauci said that the pfizer covid vaccine for children under 5 years old will be here soon the liberals science experiment is growing faster patrioticright covid19 covidvaccine childabuse https t co d7vijpbhlq https t co fpk02kj7kb,3 stars,3
Isabelle H 🇪🇺🇪🇺🇪🇺,2021-11-12 15:38:51,"@sajidjavid If the JCVI doesn’t update its advice, all kids in the age bracket 12-17 won’t be able to enter restaurants, cinema, … when going abroad. Different travel restrictions to the ones for their parents will apply to them. 

#CovidVaccine https://t.co/4jCgOnym66",sajidjavid if the jcvi doesn t update its advice all kids in the age bracket 12 17 won t be able to enter restaurants cinema when going abroad different travel restrictions to the ones for their parents will apply to them covidvaccine https t co 4jcgonym66,1 star,1
THE times OF (worlds),2021-03-19 12:27:21,"COVID-19 vaccine: Strides Pharma to produce 200 million doses of Russia's Sputnik V
#CovidVaccine
#COVID19 #russias https://t.co/Z70uNBli8o",covid 19 vaccine strides pharma to produce 200 million doses of russia s sputnik v covidvaccine covid19 russias https t co z70unbli8o,1 star,1
Sharon King (she/her),2021-03-24 09:47:14,I got vaccinated!! Let’s end this thing. #modernavaccine #CovidVaccine https://t.co/ow5iyWMY8A,i got vaccinated let s end this thing modernavaccine covidvaccine https t co ow5iywmy8a,1 star,1
Isabella Riley,2021-03-12 02:31:31,"Hey @JoeBiden, 

Neither you nor the government own us. 

We own ourselves. 

#BidenAddress #CovidVaccine",hey joebiden neither you nor the government own us we own ourselves bidenaddress covidvaccine,1 star,1
Ruben Quadros,2021-09-07 10:13:01,"Sadly we have two arms to offer for jabs but only one voice to speak up.
@vigcit99 #COVID19 #CovidVaccine #VaccinePassports #BigTech #BigPharma https://t.co/lwdYYXbpEc",sadly we have two arms to offer for jabs but only one voice to speak up vigcit99 covid19 covidvaccine vaccinepassports bigtech bigpharma https t co lwdyyxbpec,1 star,1
"Grace Lescano, RN",2021-02-25 17:22:26,"For anyone who's trying to find a place that offers the COVID vaccine, @CDCgov launched a new online tool to help p… https://t.co/Cs8AxeCF2i",for anyone who s trying to find a place that offers the covid vaccine cdcgov launched a new online tool to help p https t co cs8axecf2i,5 stars,5
Ruben Rodriguez,2020-12-30 22:44:45,There are plenty of vaccines distributed so get your heads out of your asses and vaccinate people #COVID19… https://t.co/6bMVLpZqoT,there are plenty of vaccines distributed so get your heads out of your asses and vaccinate people covid19 https t co 6bmvlpzqot,5 stars,5
Todd Unger,2021-01-28 02:20:51,"The #Biden administration wants another $1.9 TRILLION in stimulus/relief. 

Sen. Cornyn isn't so sure. 

We also di… https://t.co/f0AIOKIoSz",the biden administration wants another 1 9 trillion in stimulus relief sen cornyn isn t so sure we also di https t co f0aiokiosz,1 star,1
1st Cavalry Division,2021-02-21 17:14:27,"#FirstTeam, here’s some great information on the #COVIDVaccine https://t.co/bYYKNr0ziE",firstteam here s some great information on the covidvaccine https t co byyknr0zie,5 stars,5
Lynn Short,2021-04-26 02:39:52,I had no side effects from the second shot. #CovidVaccine,i had no side effects from the second shot covidvaccine,1 star,1
Siskin Hospital,2020-12-30 19:03:19,Our 100th Siskin Hospital associate received a first-round #CovidVaccine. Celebrating this milestone in mitigating… https://t.co/ixSxNPxUCA,our 100th siskin hospital associate received a first round covidvaccine celebrating this milestone in mitigating https t co ixsxnpxuca,5 stars,5
Dr. D,2021-04-09 08:45:47,"𝗔 𝗙𝗲𝘄 𝗙𝗮𝗰𝘁𝘀.
#BloodClots In #AstraZenaca Vaccine Recipients Are Rare.
Some #BirthControl Pills Have A Higher Risk T… https://t.co/xpF2HgO0vP",bloodclots in astrazenaca vaccine recipients are rare some birthcontrol pills have a higher risk t https t co xpf2hgo0vp,3 stars,3
Goofy 4.0,2021-01-21 19:08:59,“Website links intended to allow over-70s and health workers book their jabs have been shared on social media peopl… https://t.co/0bVtKKIE3Q,website links intended to allow over 70s and health workers book their jabs have been shared on social media peopl https t co 0bvtkkie3q,1 star,1
George Y,2021-03-23 21:06:46,So true. #COVID19 #CovidVaccine #coronavirus #CovidHoax #auspol https://t.co/9lmPtAHuzY,so true covid19 covidvaccine coronavirus covidhoax auspol https t co 9lmptahuzy,3 stars,3
Kerry Ebersole,2021-03-23 20:47:53,"Hey Team, we have maxed out our capacity for walk ups today @fordfield please only show up if you have an appointme… https://t.co/r4QkZhT18U",hey team we have maxed out our capacity for walk ups today fordfield please only show up if you have an appointme https t co r4qkzht18u,1 star,1
David Robert Newman,2021-07-05 17:34:43,"Actual and projected dates when at least 70% of each state’s residents will have had at least one #CovidVaccine, correlated with that state’s 2020 election results. Graphics by @NaemaAhmed and @n_kirkpatrick of the @washingtonpost. #GetVaccinated https://t.co/LGQGinxH0u",actual and projected dates when at least 70 of each state s residents will have had at least one covidvaccine correlated with that state s 2020 election results graphics by naemaahmed and n kirkpatrick of the washingtonpost getvaccinated https t co lgqginxh0u,1 star,1
"Hiromichi Miyashita, MD, OMD, ABFM",2020-09-15 12:39:00,"Coronavirus: UK to test inhaled vaccines

#CovidVaccine  https://t.co/7IZB1B9xiH",coronavirus uk to test inhaled vaccines covidvaccine https t co 7izb1b9xih,4 stars,4
SmlPplAgstBigGov,2022-09-12 00:01:03,"Mystery Clots Appear in 50–70 Percent of Deceased: Funeral Director

WATCH: https://t.co/JzdfR5C3dh

#ClotShot #CovidVaccine #CovidVaccines #TheGreatReset #Democide #Genocide #SADS #DiedSuddenly https://t.co/pOpoQhUl88",mystery clots appear in 50 70 percent of deceased funeral director watch https t co jzdfr5c3dh clotshot covidvaccine covidvaccines thegreatreset democide genocide sads diedsuddenly https t co popoqhul88,1 star,1
La Torre Live 🎙,2021-02-19 00:00:00,Dr. @KNaughton711 joins the guys/Futures betting/Biden’s log/#CuomoCoverup/@McDonalds new chik sandwich/@SenToomey… https://t.co/IdPLm1agOl,dr knaughton711 joins the guys futures betting biden s log cuomocoverup mcdonalds new chik sandwich sentoomey https t co idplm1agol,5 stars,5
Simon Ball,2020-11-17 11:56:04,"strange really as all we hear from the #Conservatives is that they are #AnimalWelfare fixated...
#coronavirus… https://t.co/adsr8eWIdc",strange really as all we hear from the conservatives is that they are animalwelfare fixated coronavirus https t co adsr8ewidc,2 stars,2
Gloria Bradford,2020-11-18 11:30:10,You shouldn’t use strong disinfectant to clean your body. It can be dangerous. Washing your hands thoroughly with s… https://t.co/crfUk8Q4bm,you shouldn t use strong disinfectant to clean your body it can be dangerous washing your hands thoroughly with s https t co crfuk8q4bm,2 stars,2
Virgin Media News,2021-02-25 20:13:22,"#WATCH Ireland’s health officials are reporting “clear evidence” that COVID-19 vaccines are working, as cases drop… https://t.co/D3WHTi9u6X",watch ireland s health officials are reporting clear evidence that covid 19 vaccines are working as cases drop https t co d3whti9u6x,1 star,1
The Anti Karen,2022-01-29 19:59:31,"Nice job,  Erin O'Toole @erinotoole - nice way to disrespect cancer survivors everywhere. Or, do your extremist followers think that cancer is a hoax also? 
#NeverVoteConservative #convoytoottawa2022 #convoy #Disrespect #CovidVaccine #COVIDIOTS #TerryFox https://t.co/zd1O1RUYFw",nice job erin o toole erinotoole nice way to disrespect cancer survivors everywhere or do your extremist followers think that cancer is a hoax also nevervoteconservative convoytoottawa2022 convoy disrespect covidvaccine covidiots terryfox https t co zd1o1ruyfw,4 stars,4
"Ginger Schechter, MD",2021-02-11 23:04:58,Thank you @POTUS #COVID19 #COVIDVaccine https://t.co/5eHXnWDDfK,thank you potus covid19 covidvaccine https t co 5ehxnwddfk,5 stars,5
Andrew Burns,2020-12-31 19:18:37,"Kill COVID-19 | Ireland | Level 5 part 2

Happy New Year 🎉 2021 🎉

#COVID19 #Ireland #covidvaccine #level5 https://t.co/d2Ui399Wnz",kill covid 19 ireland level 5 part 2 happy new year 2021 covid19 ireland covidvaccine level5 https t co d2ui399wnz,5 stars,5
Rasu Shrestha MD MBA,2020-12-30 22:09:13,"@epollaert The urgency of the moment, is now. 

#covidvaccine",epollaert the urgency of the moment is now covidvaccine,1 star,1
Mobile Vaccination Services,2021-11-19 12:02:00,"Most people are eligible to get the flu shot.

Get your flu shot at VaxVan! Visit https://t.co/17EPmP9adV or call 877-VAX-VAN1 to book an appointment.

#usa 
#northcarolina 
#covid 
#covidvaccine 
#getvaccinated 
#vaccinesaveslives 
#vaccine 
#VaxVan  
#COVID19 
#ServicesOffered https://t.co/uBIYYgMTsQ",most people are eligible to get the flu shot get your flu shot at vaxvan visit https t co 17epmp9adv or call 877 vax van1 to book an appointment usa northcarolina covid covidvaccine getvaccinated vaccinesaveslives vaccine vaxvan covid19 servicesoffered https t co ubiyygmtsq,1 star,1
Mencap,2021-01-28 11:55:28,"How does the #Coronavirus vaccine work and is it safe? 🤔

How is the #CovidVaccine given? 💉 

Don't worry! @DrRanj… https://t.co/zQOS7KNhYg",how does the coronavirus vaccine work and is it safe how is the covidvaccine given don t worry drranj https t co zqos7knhyg,5 stars,5
GET SOME,2021-07-11 15:06:03,"🤔 Great, now we need a rabies/#CovidVaccine as this is the next variant.
https://t.co/F2wPhgAIlb",great now we need a rabies covidvaccine as this is the next variant https t co f2wphgailb,5 stars,5
Jason Luke,2021-11-09 21:41:38,"I am so grateful for all of the #immunologist, #doctors and #scientist that worked on the #CovidVaccine. The littlest Luke was able to get his first shot today. #GetVaccinated",i am so grateful for all of the immunologist doctors and scientist that worked on the covidvaccine the littlest luke was able to get his first shot today getvaccinated,5 stars,5
Les West🇺🇸🎣⛳️🥃🐎,2022-01-11 16:07:36,"So Fauci and Walensky just admitted they have ZERO statistics to support a single statement they have made over the past 2 years about vaccinated versus unvaccinated hospitalizations. They are basing it off of ""probability"" but no actually data. Wow.. #COVID19 #CovidVaccine",so fauci and walensky just admitted they have zero statistics to support a single statement they have made over the past 2 years about vaccinated versus unvaccinated hospitalizations they are basing it off of probability but no actually data wow covid19 covidvaccine,1 star,1
Sebastian Kaupert,2021-02-14 17:25:30,Second dose done. Both my wife and I. #date #valentinesday2021 #COVIDVaccine #moderna #teacher #healthworker,second dose done both my wife and i date valentinesday2021 covidvaccine moderna teacher healthworker,5 stars,5
Sunlight Group Practice,2021-02-11 13:30:07,"#COVID19 VACCINE &amp; UNDELYING CONDITIONS 💉

Listen to Dr Gayatri Amirthalingam, Consultant in the National Immunisat… https://t.co/ScelOvC41I",covid19 vaccine amp undelying conditions listen to dr gayatri amirthalingam consultant in the national immunisat https t co scelovc41i,1 star,1
Rbk,2020-08-11 09:22:00,"Russia approves first COVID-19 vaccine, Putin says, Russia's health ministry has given regulatory approval for the… https://t.co/D4bvEcN3n3",russia approves first covid 19 vaccine putin says russia s health ministry has given regulatory approval for the https t co d4bvecn3n3,1 star,1
Diane Maguire,2021-01-26 18:10:20,"@GovRonDeSantis Can we please get @Publix in ORLANDO @OrangeCoFL To give out the vaccine, I’m still trying to get m… https://t.co/DcUXCqSKq7",govrondesantis can we please get publix in orlando orangecofl to give out the vaccine i m still trying to get m https t co dcuxcqskq7,1 star,1
PublicVibe Telugu,2021-06-21 05:20:27,"నిన్న ఒక్కరోజే 13.59 లక్షల మందికి టీకాలు
Setting record, over 13 lakh people take Covid vaccines on a single day in Andhra Pradesh
#AP #CovidVaccine #PublicVibe https://t.co/85I9Iw4wXG",13 59 setting record over 13 lakh people take covid vaccines on a single day in andhra pradesh ap covidvaccine publicvibe https t co 85i9iw4wxg,1 star,1
The QEH King's Lynn,2021-02-02 11:37:38,Our Chief Operating Officer @denisesmithnhs updates on how the Trust is responding to the 2nd wave of #COVID19 – in… https://t.co/XdDimbDzkZ,our chief operating officer denisesmithnhs updates on how the trust is responding to the 2nd wave of covid19 in https t co xddimbdzkz,5 stars,5
The Tribune,2021-12-27 01:45:00,"For now, #Covaxin likely to be only #Covidvaccine available for children of 15-18 years
https://t.co/oemwZdD64j",for now covaxin likely to be only covidvaccine available for children of 15 18 years https t co oemwzdd64j,3 stars,3
VaxBLR,2021-07-16 11:30:04,"18-44 #RURAL #Bengaluru #CovidVaccine Availability for 16/07 at 05:00PM
FREE Slots 
#COVISHIELD - Dose1:0, Dose2:1
PAID Slots 
#COVISHIELD - Dose1:35, Dose2:48
#COVAXIN - Dose1:40, Dose2:49",18 44 rural bengaluru covidvaccine availability for 16 07 at 05 00pm free slots covishield dose1 0 dose2 1 paid slots covishield dose1 35 dose2 48 covaxin dose1 40 dose2 49,1 star,1
(((vaxxed af still masked up))),2021-07-16 15:36:20,why in the actual fuck does @CNN continue to put on these families of fucking  #COVIDIOTS who literally DIE from #COVID19 ya too fucking dumb to get the #vaccine then too fucking bad. i have zero fucks left to give. the #CovidVaccine is fucking FREE. you pass. you die. BYE.,why in the actual fuck does cnn continue to put on these families of fucking covidiots who literally die from covid19 ya too fucking dumb to get the vaccine then too fucking bad i have zero fucks left to give the covidvaccine is fucking free you pass you die bye,1 star,1
Red Zone,2021-10-19 12:58:38,"Natural immunity is good. Getting vaccinated after being sick with COVID-19 is better.
#Covid_19 #CovidVaccine #Covid19 https://t.co/NXQPcx1BeM",natural immunity is good getting vaccinated after being sick with covid 19 is better covid 19 covidvaccine covid19 https t co nxqpcx1bem,4 stars,4
ticker NEWS,2021-02-08 05:15:33,"#COVIDVACCINE: ""If we cannot eliminate the virus there is a constant threat it will mutate and escape the vaccines… https://t.co/nER13kqUBd",covidvaccine if we cannot eliminate the virus there is a constant threat it will mutate and escape the vaccines https t co ner13kqubd,1 star,1
Sports Guru,2021-04-07 11:49:00,"Scene on 9th APRIL 
#BabarAzam #IPL #rcb #MI #COVID19 #COVIDー19 #CovidVaccine #wednesdaythought https://t.co/ls5iq2V2TH",scene on 9th april babarazam ipl rcb mi covid19 covid 19 covidvaccine wednesdaythought https t co ls5iq2v2th,1 star,1
Joel MacLeod,2021-01-08 23:00:53,Very interesting thread on the two #CovidVaccine tales from #onpoli and #cdnpoli https://t.co/u4sZiPRxWp,very interesting thread on the two covidvaccine tales from onpoli and cdnpoli https t co u4sziprxwp,4 stars,4
Auria 😊😃😊,2021-02-10 18:52:05,"@DrWigley @harrsica @MarkCas75317836 @Roydini25 Again, I'm sorry you're not aware of the literature concerning… https://t.co/xL7k9twiTF",drwigley harrsica markcas75317836 roydini25 again i m sorry you re not aware of the literature concerning https t co xl7k9twitf,1 star,1
BfloNP,2021-02-13 23:51:29,"I got my 2nd #COVIDVaccine yesterday and, I pretty much feel like I have the flu w/o fever but w/cold sweats. Heada… https://t.co/VRcnASJABZ",i got my 2nd covidvaccine yesterday and i pretty much feel like i have the flu w o fever but w cold sweats heada https t co vrcnasjabz,3 stars,3
TreasuryONE,2021-12-09 07:30:03,"Some gains in commodities have also helped the rand. Emerging markets firmed, and the dollar slipped against most currencies. The FOMC meeting next week remain essential. #MarketRisk #Forex #ZAR #CovidVaccine #Commodities #EmergingMarkets #Inflation #FOMC 
https://t.co/685763CrpO https://t.co/kkPUuBQBc8",some gains in commodities have also helped the rand emerging markets firmed and the dollar slipped against most currencies the fomc meeting next week remain essential marketrisk forex zar covidvaccine commodities emergingmarkets inflation fomc https t co 685763crpo https t co kkpuubqbc8,3 stars,3
Darryl Howery,2021-10-25 21:29:13,"FIRST READING: Former B.C. premier thinks COVID is a fascist (or communist) plot. I think the key here is ""former"" premier. Thank mother nature.  https://t.co/4KqcIvPrqh #Covid_19 #Covid19UK #COVIDIOTS #CovidVaccine #coronavirus #Corona #CoronaVac #VaccineCentury #VaccineMandate",first reading former b c premier thinks covid is a fascist or communist plot i think the key here is former premier thank mother nature https t co 4kqcivprqh covid 19 covid19uk covidiots covidvaccine coronavirus corona coronavac vaccinecentury vaccinemandate,1 star,1
Professor George Shuttleworth #KBF,2020-11-16 22:41:46,Yes. It's a transhumanist / evolutionary humanist project. Governments and academia are lying to you. Read Burak Tu… https://t.co/rM3Mm9YzaW,yes it s a transhumanist evolutionary humanist project governments and academia are lying to you read burak tu https t co rm3mm9yzaw,1 star,1
EDS BİLİŞİM,2021-07-14 12:38:00,"Vaccines Saved Hundreds Of Thousands Of U.S. Lives

#Vaccine #Covid19 #CovidVaccine #US https://t.co/u9maHTOqfL",vaccines saved hundreds of thousands of u s lives vaccine covid19 covidvaccine us https t co u9mahtoqfl,5 stars,5
Josiah Grindrod,2021-01-20 17:35:48,I know y'all are all happy about the murderer in chief getting yeeted from office but this is what is brightening m… https://t.co/y3BYCMotn5,i know y all are all happy about the murderer in chief getting yeeted from office but this is what is brightening m https t co y3bycmotn5,5 stars,5
Rapheala Azaniah I,2021-01-12 12:59:00,Florida doctor's death after receiving COVID-19 vaccine sparks investiga... https://t.co/qfZKimV5M7 #vaccine #CovidVaccine,florida doctor s death after receiving covid 19 vaccine sparks investiga https t co qfzkimv5m7 vaccine covidvaccine,1 star,1
Chris Ariens,2021-02-25 17:44:51,"At #ChallengerBrands, @Adweek's @tobyd hosts a special edition of the Business of Marketing with @lindayacc… https://t.co/HYydAOfzdh",at challengerbrands adweek s tobyd hosts a special edition of the business of marketing with lindayacc https t co hyydaofzdh,5 stars,5
Redacted Drone,2021-08-04 18:02:45,"OMG This is how we need to advertise the vaccine!
@FoxNews you need to run this 24 hours a day!
#CovidVaccine
#GetVaccinated
Check out Jarret Berenstein's video! #TikTok https://t.co/D4uwVUFMS3",omg this is how we need to advertise the vaccine foxnews you need to run this 24 hours a day covidvaccine getvaccinated check out jarret berenstein s video tiktok https t co d4uwvufms3,1 star,1
Er. Ranjan Chakraborty(रंजन/রঞ্জন)🇮🇳,2020-12-28 16:43:31,As a law abiding citizen of India I want to ask @PMOIndia @narendramodi when are you going to give green signal for… https://t.co/ltEGgmYLP4,as a law abiding citizen of india i want to ask pmoindia narendramodi when are you going to give green signal for https t co lteggmylp4,1 star,1
Christy Johns,2021-02-22 00:47:32,Vinnie the Vaccine is hitting the streets of Brisbane to find out how excited people are to get the jab. Stay tuned… https://t.co/ljaYOhKbuk,vinnie the vaccine is hitting the streets of brisbane to find out how excited people are to get the jab stay tuned https t co ljayohkbuk,1 star,1
